{
    "question": "优刻得科技股份有限公司主营业务",
    "contexts": [
        "前言\n优刻得科技股份有限公司主营业务是自主研发并提供以计算、存储、网络等企业必需的基础IT产品为主的云计算服务。公司主要产品或服务有公有云、私有云、混合云、数据可信流通平台安全屋。\n优刻得2022年主营业务收入净额为197,221.87万元，与2021年的290,124.72万元相比大幅下降，下降了32.02%。2022年主营业务成本为180,758.96万元，与2021年的280,378.05万元相比大幅下降，下降了35.53%。公司主营业务收入和主营业务成本同时下降，但成本的下降幅度大于收入的下降幅度，说明公司主营业务盈利能力提高。\n",
        "优刻得——2023企业能力分析研究报告\n优刻得科技股份有限公司主营业务是自主研发并提供以计算、存储、网络等企业必需的基础IT产品为主的云计算服务。公司主要产品或服务有公有云、私有云、混合云、数据可信流通平台安全屋。\n优刻得2022年主营业务收入净额为197,221.87万元，与2021年的290,124.72万元相比大幅下降，下降了32.02%。2022年主营业务成本为180,758.96万元，与2021年的280,378.05万元相比大幅下降，下降了35.53%。公司主营业务收入和主营业务成本同时下降，但成本的下降幅度大于收入的下降幅度，说明公司主营业务盈利能力提高。",
        "1计算公式为：(2020年平均单价 /2018年平均单价)^-1 1-1-37 优刻得科技股份有限公司募集说明书3、公司主要业务的毛利率变化情况（1）公司主要业务的毛利率变化情况2018 年.2021年上半年，公司各业务板块的毛利率变动情况如下：项目 2018年 2019年 相较 2018年 变动（百 分点） 2019年 2020年相 较 2019年 变动 （百分点） 2020年 2020年 1-6月 2021年 1-6月同 比变动 （百分 点）2021年 1-6月 公有云 41.85% -10.59 31.26% -25.41 5.84% 16.44% -15.65 0.79%混合云 25.52% -6.23 19.29% -2.5016.80% 18.47% -2.17 16.30%私有云 及其他 44.67% -19.98 24.69% -10.3114.38% 10.54% 1.38 11.92% 主营业 务毛利 率 40.02% -11.00 29.02% -20.62 8.39% 16.44% -12.71 3.73%2019年公司主营业务毛利率相较 2018年下降 11个百分点，2020年公司主营业务 毛利率相较 2019年下降约 20.62个百分点。公司主营业务毛利主要来自公有云业务板 块，2020年公司公有云毛利率相比 2018年共下滑 36.01个百分点，2021年 1-6月公司 毛利率相较 2020年全年进一步下滑，主营业务毛利率为 3.73%，但相比 2021年 1-3月 主营业务毛利率 2.85%提升了 0.88个百分点，公有云毛利率相比 2020年 1-3月上升 0.15 个百分点。2021年上半年公司的毛利率低于预期，主要系 2020年四季度以来公司收入 快速增长，大客户贡献的 CDN收入占比进一步提高。CDN收入占比 2021年 1-6月同 比 2020年 1-6月提高 20.21个百分点，而针对大客户的 CDN 业务毛利率较低，导致公 司 2021年上半年毛利率整体低于预期。报告期公司主营业务毛利率呈现逐年下降趋势。",
        "私有云及其 他合计 344,440,649.48 294,896,409.15 14.38 375.03 440.05减少 10.31 个百分点2020年度，私有云及其他业务收入34,444.06万元，同比增长375.03%，成本29,489.64 万元，同比增长440.05%，毛利率14.38%，同比下降10.31个百分点。2020年公司发力拓展 金融机构、大型央企、电信运营商、政府机构及零售业等传统企业的私有云业务，收入大幅 增长，而与公有云相比，私有云具有用户定制化的特征，基于客户所处的不同行业、不同规 模，项目毛利都会存在差异。对于大规模的项目，公司在投标时会结合客户预算、竞争对手 情况、项目交付成本等因素综合考虑，使用竞争定价法进行报价，此类项目的毛利率一般会 较低。堡垒机为公司的一款公有云产品，2020年收入150.29万元，成本53.44万元，毛利率 64.44%。数据可信流通平台安全屋（即安全屋）将堡垒机、密钥管理、权限控制等安全技术 相融合，提供一整套基于云端的安全技术、计算技术和流通规则，确保数据所有者对数据的 绝对控制权，数据需求方仅可获得计算分析后的结果，无法接触原始数据，确保在数据所有 权不变的情况下，实现数据的安全共享，规避了数据的二次交易、数据泄露等风险。二、定期报告修改及补充披露 公司已在 2020年年度报告之 “第四节 经营情况讨论与分析 ”之 “三 、 报告期 内主要经营情况 ”之 “（ 一 ） 主营业务分析 2.收入和成本分析 .主营业务分行业 、 分产品 、 分地区情况 ”中补充披露公有云业务下计算 、 网络 、 存储 、 数据库 、 云 分发、数据分析等细分模块对应的收入、成本以及毛利率情况。公司已在 2020年年度报告之 “第四节 经营情况讨论与分析 ”之 “三 、 报告期 内主要经营情况 ”之 “（ 一 ） 主营业务分析 2.收入和成本分析 .主营业务分行业 、 分产品 、 分地区情况 ”中补充披露 按照地区分业务的收入、成本以及毛利率情况。",
        "江西金达莱环保股份有限公司主营业务为污水处理成套设备的研发、生产与销售，并为污水排放企事业单位及专业污水处理企业提供污水处理与资源化整体解决方案。3月14日，此前计划上市创业板的泰坦科技发布公告称，董事会审议通过议案，决定将上市地点变更为上交所科创板。",
        "江西金达莱环保股份有限公司主营业务为污水处理成套设备的研发、生产与销售，并为污水排放企事业单位及专业污水处理企业提供污水处理与资源化整体解决方案。3月14日， 此前计划上市创业板的泰坦科技发布公告称，董事会审议通过议案，决定将上市地点变更为上交所科创板。",
        "江西金达莱环保股份有限公司主营业务为污水处理成套设备的研发、生产与销售，并为污水排放企事业单位及专业污水处理企业提供污水处理与资源化整体解决方案。3月14日， 此前计划上市创业板的泰坦科技发布公告称，董事会审议通过议案，决定将上市地点变更为上交所科创板。",
        "公司已在 2020年年度报告之 “第二节 公司简介和主要财务指标 ”之 “八 、 2020 年分季度主要财务数据 ”中补充披露截至 2021年一季度的分季度主要业务毛利 率变动情况； 公司已在 2020年年度报告之 “第四节 经营情况讨论与分析 ”之 “三 、 报告期 内主要经营情况 ”之 “（ 一 ） 主营业务分析2.收入和成本分析 .成本分析表 ”中 补充披露 CDN 业务成本的具体构成，并在“.主要销售客户及主要供应商情况 A.公司主要销售客户情况 ”中 补充披露CDN业务主要客户情况。公司已在 2020年年度报告之 “第四节 经营情况讨论与分析 ”之 “三 、 报告期 内主要经营情况 ”之 “（ 一 ） 主营业务分析2.收入和成本分析 .主营业务分行业 、 分产品 、 分地区情况 ”中 补充披露私有云及其他业务的安全屋 、 堡垒机等产 品收 入、成本构成情况。问题 2： 关于应收账款。年报显示， 2020年公司应收账款期末余额 49， 624.34万元， 占营业收入的比例为 20.21%，同比增长 91.40%。其中 2020年度按单项计提 100% 坏账准备 2,121.87万元。请公司补充披露上述应收账款的欠款方情况、与公司是 否存在关联关系、无法收回的原因、对应的业务情况以及公司是否采取措施督促 相关客户及时付款。答复： 一、对问询问题的答复 （一）坏账计提的方法公司以单项或组合的方式对应收账款的预期信用损失进行估计，计提坏账准 备。如果有客观证据表明某项应收账款已经发生信用减值，则公司在单项基础上 对该应收账款计提减值准备。（二）单项计提坏账 2020年度，公司按单项计提坏账准备的应收账款相关情况如下：单位：万元 序 号 客户名称 账面余 额 坏账准 备 客户所属 行业 业务 账龄关联 关系1年以 内 1年-2 年 2年以 上 1 上海谦问万答吧云 计算科技有限公司 573.99 573.99 互联网- 在线教育 公有云 573.99无 序 号客户名称 账面余 额 坏账准 备 客户所属 行业 业务 账龄 关联 关系1年以 内 1年-2 年 2年以 上 2 北京蓝汛通信技术 有限责任公司560.26 560.26互联网- 云分发 公有云107.30 452.96 无3",
        "巨人网络集团股份有限公司现主营业务为互联网游戏的研发和运营。2016年4月19日巨人网络借壳上市成功，原主营业务由涉外豪华游轮运营业务和旅行社业务变更为现在的网络游戏。\n",
        "（二）公司归属于母公司所有者的净利润下降主要由于：\n首先，公司主营业务毛利率较上年同期下滑约20到22个百分点，主要因素包括：（1）低毛利的业务收入占比快速提升导致的主营业务整体毛利率下降；（2）价格下调导致的主要产品或服务自身毛利率的下降；（3）服务器的升级换代使得一段时间内成本的叠加，及公司疫情期推出免费云产品引流致使效益下降。\n其次，公司为吸引人才，提高薪酬，实施员工股权激励计划，加大研发等人力成本投入，导致本期人力成本和股份支付合计较上年同期增加约1亿元。\n（三）公司归属于母公司所有者的扣除非经常性损益的净利润下降，主要系归属于母公司所有者的净利润下降所致。\n四、风险提示\n公司不存在影响本次业绩预告内容准确性的重大不确定因素。目前公司经营情况正常，生产经营未出现重大不利变化。\n五、其他说明事项\n以上预告数据仅为初步核算数据，具体准确的财务数据以公司正式披露的经审计后的2020年年度报告为准，敬请广大投资者注意投资风险。\n特此公告。\n优刻得科技股份有限公司\n董事会\n2021年1 月30日\n大家都在聊\n相关推荐\n热门视频\n热点搜索",
        "优刻得科技股份有限公司主营业务是自主研发并提供以计算、存储、网络等企业必需的基础IT产品为主的云计算服务。公司主要产品或服务有公有云、私有云、混合云、数据可信流通平台安全屋。公司2018年8月荣获“2018福布斯中国最具创新力企业”;2018年10月荣获“上海市科技小巨人企业”;2019年8月,公司获得由中国互联网协会、工业和信息化部网络安全产业发展中心颁发的2019\n年中国互联网企业100强。近一年公司股价累计下跌42.78%，同期沪深300指数下跌-22.73%。!喜欢 就请订阅我 第一时间为您推送 订阅 ## 相关新闻",
        "优刻得科技股份有限公司主营业务是自主研发并提供以计算、存储、网络等企业必需的基础IT产品为主的云计算服务。公司主要产品或服务有公有云、私有云、混合云、数据可信流通平台安全屋。公司2018年8月荣获“2018福布斯中国最具创新力企业”;2018年10月荣获“上海市科技小巨人企业”;2019年8月,公司获得由中国互联网协会、工业和信息化部网络安全产业发展中心颁发的2019 年中国互联网企业100强。\n近一年公司股价累计下跌33.48%，同期沪深300指数下跌-23.95%。\n0人+1\n- 每日推荐\n- 股票频道\n- 要闻频道\n- 港股频道\n- 国资委要求央企加快布局人工智能\n- 突发！这家公司实控人被立案\n-",
        ".......................................................\n7 （二）股权结构、控股股东及实际控制人情况.............................................................\n7 （三）所处行业的主要特点及行业竞争情况.................................................................\n9 （四）主要业务模式、产品或服务的主要内容...........................................................\n14 （五）科技创新水平以及保持科技创新能力的机制或措施 .......................................30 （六）现有业务发展安排及未来发展战略...................................................................\n35 （七）公司经营业绩变化情况.......................................................................................\n36 （八）发行人开拓大客户的情况及为获客降价对公司 2020年度业绩的影响.........41 （九）本次募投项目对发行人主营业务及财务状况的影响及公司盈利情况的预计42二、本次证券发行概要.........................................................................................................\n48 （一）本次发行的背景和目的.......................................................................................\n48 （二）发行对象及与发行人的关系...............................................................................\n",
        "威胜信息或将成“科创板湖南第一股”。\n公开资料显示，威胜信息成立于2004年5月8日，是港股威胜控股有限公司旗下专注于物联网领域的核心子公司，主营业务为智能电网、智慧能源（水/气/热）、智慧路灯、智慧安防/人防等领域综合应用解决方案，产品贯穿物联网感知层、网络层与应用层。\n今年10月14日威胜信息科创板成功过会，随后提交注册申请。截至记者发稿时，湖南南新制药股份有限公司、湖南松井新材料股份有限公司、湖南金博碳素股份有限公司最新状态均为“已问询”。\n>>我要举报",
        "（三）归属于母公司所有者的扣除非经常性损益的净利润：997.87万元。\n三、本期业绩变化的主要原因\n（一）公司营业收入增长，主要系公有云收入增加所致。公司上市以来优先扩大业务体量规模，引入了一些互联网细分行业头部客户，开拓的大客户收入实现了快速增长，积累规模效应，为后续向其提供更高附加值的云计算产品服务，进一步提高公司产品服务的复用率，奠定基础。\n（二）公司归属于母公司所有者的净利润下降主要由于：\n首先，公司主营业务毛利率较上年同期下滑约20到22个百分点，主要因素包括：（1）低毛利的业务收入占比快速提升导致的主营业务整体毛利率下降；（2）价格下调导致的主要产品或服务自身毛利率的下降；（3）服务器的升级换代使得一段时间内成本的叠加，及公司疫情期推出免费云产品引流致使效益下降。\n其次，公司为吸引人才，提高薪酬，实施员工股权激励计划，加大研发等人力成本投入，导致本期人力成本和股份支付合计较上年同期增加约1亿元。\n（三）公司归属于母公司所有者的扣除非经常性损益的净利润下降，主要系归属于母公司所有者的净利润下降所致。\n四、风险提示\n公司不存在影响本次业绩预告内容准确性的重大不确定因素。目前公司经营情况正常，生产经营未出现重大不利变化。\n五、其他说明事项\n以上预告数据仅为初步核算数据，具体准确的财务数据以公司正式披露的经审计后的2020年年度报告为准，敬请广大投资者注意投资风险。\n特此公告。\n优刻得科技股份有限公司\n董事会\n2021年 1 月30日",
        "宁波建工(601789)\n公司及全资子公司参股投资了主营业务为数据中心运营的中经云数据存储科技有限公司，直接加间接持有其32.07%股权。",
        "宁波建工(601789)\n公司及全资子公司参股投资了主营业务为数据中心运营的中经云数据存储科技有限公司，直接加间接持有其32.07%股权。",
        "云分发 （按带宽 计费） -7.92% -0.92%-28.43% -22.87% -25.67%注：上表数据通过产品收入与产品销量计算平均单价从而得出 上述五款核心产品平均单价 2020年相比 2019年分别下降了 28.53%、8.67%、 17.03%、19.22%和 28.43%，降价幅度较大，导致公司 2020年主营业务毛利率大幅下降。2021年 1-3月公司云主机、机柜托管、云分发（按带宽计费）价格环比 2020年 10-12 月价格仅下降 5.80%、5.30%、7.92%，而 UNet（按带宽计费）及 UDB数据库则分 别上涨 5.63%、1.11%，从季度数据来看，核心产品整体价格变动趋势自 2020年下半 年以来逐步企稳。公司主要产品 2018年起整体呈现下降的趋势，且降价幅度较大，未 来云计算市场的竞争可能仍较为激烈，主要云计算厂商存在采取持续竞争性降价以实现 市场份额短期提升的可能性，面对激烈市场竞争公司可能存在未来几年产品持续降价的 情况。3、公司毛利率持续下滑的风险 2018年至 2021年一季度，公司各业务板块的毛利率变动情况如下：1计算公式为：(2020年平均单价 /2018年平均单价)^ -1 3-1-25 优刻得科技股份有限公司发行保荐书 项目2018年 2019年 相较 2018年 变动（百 分点）2019年 2020年相 较 2019年 变动 （百分 点）2020年 2021年 1-3 月同比 2020年 1-3 月变动（百 分点）2021年 1-3 月环比 2020 年 10-12月 变动（百分 点）2021年 1-3月 公有云 41.85% -10.59 31.26% -25.41 5.84% -19.89 4.91 0.64%混合云 25.52% -6.2319.29% -2.5 16.80% -6.34 2.75 13.03%私有云 及其他 44.67% -19.98 24.69% -10.31 14.38% -0.49 -10.90 9.86% 主营业 务毛利 率 40.02% -11.00 29.02% -20.628. 39% -17.28 0.60 2.85%2019年公司主营业务毛利率相较 2018年下降 11个百分点，2020年公司主营业务 毛利率相较 2019年下降约 20.62个百分点。",
        "优刻得科技股份有限公司主营业务是自主研发并提供以计算、存储、网络等企业必需的基础IT产品为主的云计算服务。公司主要产品或服务有公有云、私有云、混合云、数据可信流通平台安全屋。公司2018年8月荣获“2018福布斯中国最具创新力企业”;2018年10月荣获“上海市科技小巨人企业”;2019年8月，公司获得由中国互联网协会、工业和信息化部网络安全产业发展中心颁发的2019\n年",
        "10月28日，资本邦了解到，A股上市公司优刻得（代码：688158.SH）发布2021年前三季度业绩报告。\n公司所属行业为计算机应用。\n公司报告期内，期末资产总计为48.84亿元，营业利润为-5.02亿元，应收账款为6.85亿元，经营活动产生的现金流量净额为4938.79万元，销售商品、提供劳务收到的现金为23.20亿元。\n优刻得，公司全称优刻得科技股份有限公司，成立于2012年03月16日，现任总经理季昕华，主营业务为自主研发并提供以计算、存储、网络等企业必需的基础IT产品为主的云计算服务。\n有连云5.7万获赞 30.8万粉丝",
        "芜湖三七互娱网络科技集团股份有限公司的主营业务包括手机游戏和网页游戏的研发、发行和运营。公司的主要产品为网页游戏、移动游戏。公司手机游戏和网页游戏的运营模式主要包括自主运营和第三方联合运营两种。\n深圳中青宝互动网络股份有限公司是一家具有自主研发、运营能力、代理能力的专业化网络游戏公司。公司的主营业务是网络游戏的开发及运营，由研发中心、运营中心、运维技术中心和综合管理中心构成了清晰完整的业务系统。\n湖北盛天网络技术股份有限公司是国内领先的场景化互联网平台，围绕多个场景构建了包含平台，内容，服务的一体化运营体系，发展出互联网营销，游戏运营与发行，IP运营三大主营业务。主要产品包括随乐游云游戏，易乐玩游戏，易乐游网娱等。\n杭州顺网科技股份有限公司主营业务是互联网技术平台即服务。公司主要产品为针对网吧渠道的互联网娱乐平台以及网吧管理和计费系统的设计、开发和销售；同时利用网吧管理和计费系统所形成的媒体传播效应及所覆盖的网民用户资源，提供网络广告及推广服务和互联网增值服务等。\n优刻得科技股份有限公司主营业务是自主研发并提供以计算、存储、网络等企业必需的基础IT产品为主的云计算服务。公司主要产品或服务有公有云、私有云、混合云、数据可信流通平台安全屋。\n万向新元科技股份有限公司立足于智能装备制造行业，一直专注于智能装备的研发、制造、销售并提供相应的成套解决方案。公司主要产品包括智能输送配料装备、绿色环保装备、智能数字显控及存储装备、智能专用装备、智能裂解装备。\n小浔论市1720获赞 965粉丝",
        "10月28日，资本邦了解到，A股上市公司优刻得（代码：688158.SH）发布2021年前三季度业绩报告。\n公司所属行业为计算机应用。\n公司报告期内，期末资产总计为48.84亿元，营业利润为-5.02亿元，应收账款为6.85亿元，经营活动产生的现金流量净额为4938.79万元，销售商品、提供劳务收到的现金为23.20亿元。\n优刻得，公司全称优刻得科技股份有限公司，成立于2012年03月16日，现任总经理季昕华，主营业务为自主研发并提供以计算、存储、网络等企业必需的基础IT产品为主的云计算服务。\n有连云5.8万获赞 30.8万粉丝",
        "10月28日，资本邦了解到，A股上市公司优刻得（代码：688158.SH）发布2021年前三季度业绩报告。\n公司所属行业为计算机应用。\n公司报告期内，期末资产总计为48.84亿元，营业利润为-5.02亿元，应收账款为6.85亿元，经营活动产生的现金流量净额为4938.79万元，销售商品、提供劳务收到的现金为23.20亿元。\n优刻得，公司全称优刻得科技股份有限公司，成立于2012年03月16日，现任总经理季昕华，主营业务为自主研发并提供以计算、存储、网络等企业必需的基础IT产品为主的云计算服务。\n有连云5.7万获赞 30.8万粉丝",
        "云分发 （按带宽 计费） -7.92% -0.92%-28.43% -22.87% -25.67%注：上表数据通过产品收入与产品销量计算平均单价从而得出 上述五款核心产品平均单价 2020年相比 2019年分别下降了 28.53%、8.67%、 17.03%、19.22%和 28.43%，降价幅度较大，导致公司 2020年主营业务毛利率大幅下降。2021年 1-3月公司云主机、机柜托管、云分发（按带宽计费）价格环比 2020年 10-12 月价格仅下降 5.80%、5.30%、7.92%，而 UNet（按带宽计费）及 UDB数据库则分 别上涨 5.63%、1.11%，从季度数据来看，核心产品整体价格变动趋势自 2020年下半 年以来逐步企稳。公司主要产品 2018年起整体呈现下降的趋势，且降价幅度较大，未 来云计算市场的竞争可能仍较为激烈，主要云计算厂商存在采取持续竞争性降价以实现 市场份额短期提升的可能性，面对激烈市场竞争公司可能存在未来几年产品持续降价的 情况。3、公司毛利率持续下滑的风险 2018年至 2021年一季度，公司各业务板块的毛利率变动情况如下：1计算公式为：(2020年平均单价 /2018年平均单价)^ -1 3-1-25 优刻得科技股份有限公司发行保荐书 项目2018年 2019年 相较 2018年 变动（百 分点）2019年 2020年相 较 2019年 变动 （百分 点）2020年 2021年 1-3 月同比 2020年 1-3 月变动（百 分点）2021年 1-3 月环比 2020 年 10-12月 变动（百分 点）2021年 1-3月 公有云 41.85% -10.59 31.26% -25.41 5.84% -19.89 4.91 0.64%混合云 25.52% -6.2319.29% -2.5 16.80% -6.34 2.75 13.03%私有云 及其他 44.67% -19.98 24.69% -10.31 14.38% -0.49 -10.90 9.86% 主营业 务毛利 率 40.02% -11.00 29.02% -20.628. 39% -17.28 0.60 2.85%2019年公司主营业务毛利率相较 2018年下降 11个百分点，2020年公司主营业务 毛利率相较 2019年下降约 20.62个百分点。",
        "优刻得-W\n] >优刻得-W-公告正文 * 公告正文*[点击查看优刻得-W更多公告点击查看优刻得-W更多公告\")个股公告查询：- __查看PDF原文公告日期：- *当前第 1页**上一页**下一页* *共 页* *郑重声明：* 本网不保证其真实性和客观性，一切有关该股的有效信息，以交易所的公告为准，敬请投资者注意风险。优刻得-W *688158* 停牌市盈率- * 总市值- * 流通值- 优刻得-W资金流向 当日资金流向 历史资金流向 优刻得-W特色数据* 优刻得-W财务数据 优刻得-W股东研究 十大流通股东 数据日期：- * 优刻得-W核心题材 所属板块 主营业务 经营范围 题材要点 最新研报最新公告 数据来源： *郑重声明：*\n东方财富网发布此信息的目的在于传播更多信息，与本站立场无关。",
        "芜湖三七互娱网络科技集团股份有限公司的主营业务包括手机游戏和网页游戏的研发、发行和运营。公司的主要产品为网页游戏、移动游戏。公司手机游戏和网页游戏的运营模式主要包括自主运营和第三方联合运营两种。\n深圳中青宝互动网络股份有限公司是一家具有自主研发、运营能力、代理能力的专业化网络游戏公司。公司的主营业务是网络游戏的开发及运营，由研发中心、运营中心、运维技术中心和综合管理中心构成了清晰完整的业务系统。\n湖北盛天网络技术股份有限公司是国内领先的场景化互联网平台，围绕多个场景构建了包含平台，内容，服务的一体化运营体系，发展出互联网营销，游戏运营与发行，IP运营三大主营业务。主要产品包括随乐游云游戏，易乐玩游戏，易乐游网娱等。\n杭州顺网科技股份有限公司主营业务是互联网技术平台即服务。公司主要产品为针对网吧渠道的互联网娱乐平台以及网吧管理和计费系统的设计、开发和销售；同时利用网吧管理和计费系统所形成的媒体传播效应及所覆盖的网民用户资源，提供网络广告及推广服务和互联网增值服务等。\n优刻得科技股份有限公司主营业务是自主研发并提供以计算、存储、网络等企业必需的基础IT产品为主的云计算服务。公司主要产品或服务有公有云、私有云、混合云、数据可信流通平台安全屋。\n万向新元科技股份有限公司立足于智能装备制造行业，一直专注于智能装备的研发、制造、销售并提供相应的成套解决方案。公司主要产品包括智能输送配料装备、绿色环保装备、智能数字显控及存储装备、智能专用装备、智能裂解装备。\n小浔论市1720获赞 965粉丝",
        "2021年 1-3月公司主营业务毛利率相较 2020 年 1-3月同比下降约 17.28个百分点，环比上升 0.60个百分点。公司主营业务毛利主要 来自公有云业务板块，2020年公司公有云毛利率相比 2018年共下滑 36.01个百分点， 近三年一期公司主营业务毛利率与公有云毛利率均呈现逐年下降趋势。2018年至 2021年一季度，公司低毛利业务收入占比进一步提高，针对互联网头部 客户公司提供一定折扣，主要产品及服务的价格下调并增加了固定资产投资，以上综合 因素导致公司毛利率持续下滑。由于云计算行业市场存在一定的不确定性，如未来云计 算市场发展方向大幅改变，竞争对手的策略选择发生较大变化均有可能一定程度上影响 公司的毛利率。公司毛利率未来存在持续下滑的风险。4、公司华东地区客户收入占比较低，存在募投项目客户开拓及产能消化的风险报告期内公司华东地区机房的收入占整体营业收入的比重较低，具体情况如下表所 示：单位：万元 收入区域 2021年 1-3月 2020年 收入占比同比增速收入占比同比增速 华东地区 18,836.47 26.50%155.07% 41,476.2116.89% 176.26% 营业收入71,086.25 100.00%72.31%245,513.43100.00%62.06%收入区域2019年 2018年 3-1-26 优刻得科技股份有限公司发行保荐书收入区域 2021年 1-3月 2020年 收入占比同比增速收入占比同比增速 收入占比同比增速收入占比同比增速 华东地区 15,013.70 9.91% 41.81% 10,587.54 8.92%48.88%营业收入151,491.76 100.00%27.58% 118,743.32 100.00% 41.39%注：上述数据中心业务收入包括计算、网络、数据库、数据分析、存储、云分发等，其中云分发业 务的收入按照长三角地区云分发带宽量占公司全部云分发带宽量的比例折算。报告期内，公司华东地区机房的收入占比分别为 8.92%、9.91%、16.89%及 26.50%， 占比较低，未来募投项目的客户开拓及产能消化存在一定风险。",
        "2021年 1-3月公司主营业务毛利率相较 2020 年 1-3月同比下降约 17.28个百分点，环比上升 0.60个百分点。公司主营业务毛利主要 来自公有云业务板块，2020年公司公有云毛利率相比 2018年共下滑 36.01个百分点， 近三年一期公司主营业务毛利率与公有云毛利率均呈现逐年下降趋势。2018年至 2021年一季度，公司低毛利业务收入占比进一步提高，针对互联网头部 客户公司提供一定折扣，主要产品及服务的价格下调并增加了固定资产投资，以上综合 因素导致公司毛利率持续下滑。由于云计算行业市场存在一定的不确定性，如未来云计 算市场发展方向大幅改变，竞争对手的策略选择发生较大变化均有可能一定程度上影响 公司的毛利率。公司毛利率未来存在持续下滑的风险。4、公司华东地区客户收入占比较低，存在募投项目客户开拓及产能消化的风险报告期内公司华东地区机房的收入占整体营业收入的比重较低，具体情况如下表所 示：单位：万元 收入区域 2021年 1-3月 2020年 收入占比同比增速收入占比同比增速 华东地区 18,836.47 26.50%155.07% 41,476.2116.89% 176.26% 营业收入71,086.25 100.00%72.31%245,513.43100.00%62.06%收入区域2019年 2018年 3-1-26 优刻得科技股份有限公司发行保荐书收入区域 2021年 1-3月 2020年 收入占比同比增速收入占比同比增速 收入占比同比增速收入占比同比增速 华东地区 15,013.70 9.91% 41.81% 10,587.54 8.92%48.88%营业收入151,491.76 100.00%27.58% 118,743.32 100.00% 41.39%注：上述数据中心业务收入包括计算、网络、数据库、数据分析、存储、云分发等，其中云分发业 务的收入按照长三角地区云分发带宽量占公司全部云分发带宽量的比例折算。报告期内，公司华东地区机房的收入占比分别为 8.92%、9.91%、16.89%及 26.50%， 占比较低，未来募投项目的客户开拓及产能消化存在一定风险。",
        "优刻得-W\n] >优刻得-W-公告正文 * 公告正文*[点击查看优刻得-W更多公告点击查看优刻得-W更多公告\")个股公告查询：- __查看PDF原文公告日期：- *当前第 1页**上一页**下一页* *共 页* *郑重声明：* 本网不保证其真实性和客观性，一切有关该股的有效信息，以交易所的公告为准，敬请投资者注意风险。优刻得-W *688158* 停牌市盈率- * 总市值- * 流通值- 优刻得-W资金流向 当日资金流向 历史资金流向 优刻得-W特色数据* 优刻得-W财务数据 优刻得-W股东研究 十大流通股东 数据日期：- * 优刻得-W核心题材 所属板块 主营业务 经营范围 题材要点 最新研报最新公告 数据来源： *郑重声明：*\n东方财富网发布此信息的目的在于传播更多信息，与本站立场无关。",
        "镁伽宣布完成 6500万美元新融资，药明康德领投\n镁伽5月28日正式宣布完成由药明康德领投的6500万美元的新一轮融资，老股东愉悦资本、创新工场、经纬中国、博世创投、明势资本及联东投资跟投。自2020年11月份以来，镁伽在6个月时间内累计完成了1.25亿美元融资。\n本轮融资募集的资金将继续深化镁伽在生命科学智能自动化领域的产品研发与技术升级、夯实主营业务能力并发挥与药明康德的深层次战略协同效应；同时，进一步加大“镁伽鲲鹏实验室”的投入建设。"
    ],
    "ground_truth": "答案: 优刻得科技股份有限公司的主营业务是自主研发并提供基于计算、存储和网络的基础IT产品的云计算服务。公司的主要产品或服务包括公有云、私有云、混合云及数据可信流通平台安全屋。此外，公司在私有云领域主要面向金融机构、大型央企、电信运营商、政府机构及零售业等提供用户定制化的云服务。公有云产品中，公司提供堡垒机等安全技术整合的产品。公司的云计算服务涵盖计算、网络、存储、数据库、云分发和数据分析等细分模块。",
    "answer": "优刻得科技股份有限公司的主营业务主要包括以下几个方面：\n\n1. 云计算服务：公司专注于云计算领域，包括公有云、混合云、私有云、专有云等综合性行业解决方案的提供。提供技术开发、技术转让、技术咨询和技术服务。\n\n2. 大数据与人工智能：涵盖大数据流通平台、AI服务平台等，为客户提供大数据服务、云软件服务等。\n\n3. 产品与服务：自主研发的产品包括IaaS、PaaS等云计算产品，以及“数字哨兵”系统，智能防疫一体机、混合云架构、多云管理平台UCMP等。\n\n4. 技术支持与解决方案：提供安全屋数据沙箱服务、人工智能公共服务平台等技术产品和平台服务。为客户提供全面的云计算、大数据和人工智能技术产品及应用场景解决方案，帮助客户提升数字化能力。\n\n优刻得科技股份有限公司通过这些业务和产品，满足不同场景下的业务需求，提高通行效率、减少排队拥堵等问题，推动产业数字化和数字产业化。"
}