{
    "question": "优刻得科技股份有限公司该企业的未来发展规划是什么",
    "contexts": [
        "在您自己的愿景中，UCloud优刻得在跟隐私计算赛道结合的时候，未来三到五年的目标是什么？\n季昕华：\n我们把数据流通分成三个发展阶段。第一个阶段是帮助政府做数据开放，这是我们第一阶段要做的事。现在我们已经树立了沪惠保、上海普惠金融平台等不少行业标杆，下一步就是要在全国做推广。\n第二阶段是推动企业和企业的数据流通，我们想努力找准合适的落地行业，让数据开放流通产生真的价值。\n第三个就是做跨境的数据交流。在我的理想状态中，数据应该像商品一样跨境，但如何安全合规地通过跨境发挥价值，就需要政府和企业来探索，需要更多创新。\n相关法律法规出台2022年是隐私计算迈向合规发展的一年\n算力智库：\n在您创业过程中，您有过哪些挣扎与实践？能否跟我们讲讲您创业中最困难的事情是什么？您是如何克服的？\n季昕华：\n挣扎很大。期间，行业里的不少人都看不清这个方向，也不认可，当时压力是很大的。\n我一直认为数据是商品，我当时研究整个商品的发展历史，我觉得数据的发展历史和商品的发展历史是一样的。以前商品不允许流通的，后面有各种机制才让商品流通起来，数据也是有它的相似性，但是又有不一样的地方。我们也希望能找到一个机制，既能确保数据流通，又会确保数据安全。一路坚持到现在。\n算力智库：\n这么多年，我们接触了很多隐私计算厂商，有的可能就干一年到两年，最多干三到四年，大家属于提着一口气，刚好遇到一个好的红利，又吸了一口气再往上跑。现在提了一口气的这些人，可能有一些人会退出的。您已经经过几轮牛熊周期了，您的创业感悟有什么可以拿来跟大家分享的吗？\n季昕华：\n我觉得2022年是隐私计算要面对挑战的一年。为什么这么说呢，因为投资过热，容易导致内卷，导致项目上不赚钱也做，这是一个比较大的挑战。\n总体来讲是一种资源浪费。比如原来一个项目正常几百万，现在十万都做，大家都在抢，会导致整个行业陷入恶性竞争，很难健康发展，这是我比较担心的一点。\n另外，现在《数据安全法》实施，什么事能做、什么事不能做有了更明确地规范，这对于一部分行业内的企业而言，要合法地活下来就已经是很大的挑战。\n合规、确权、定价等难题亟待解决\n算力智库：\n未来的两到三年，隐私计算在场景的落地当中，您认为有哪些制约因素？\n季昕华：\n我觉得制约因素有三点。第一个是确权问题。确权的问题现在还不能很好的解决。",
        "上海市浙江青年企业家协会会长、优刻得科技股份有限公司董事长季昕华在主题分享中表示，科技创新是推动社会进步和经济发展的重要力量，科技企业需要与金融机构建立良好的合作关系，共同应对市场的挑战和机遇。\n在交流环节，参会企业家及银行工作人员以科创企业融资为主题，深入探讨科创企业发展规划及经营难点，并结合具体案例交流意见。\n",
        "[![RB螺纹钢期货交易网-用实战期货交易系统和心得助你重塑交易认知螺纹钢期货交易网螺纹钢期货交易网-用实战期货交易系统和心得助你重塑交易认知\") 只发布交易干货的网站用实战期货交易系统和心得助你重塑交易认知* 期货交易干货 * 服务与公告 * 文章 商品 问答 __ >> 举债能力是什么意思？举债能力不足是什么意思[ ##正规期货开户 | 手续费只+1分 90%交易者的手续费都被加收超1倍，一起看看最新的交易所手续费一览表吧阅读 评论__隐藏侧边 __显示侧边 举债能力是什么意思呢？简单来说，就是一个人的财力，可以支撑他做任何事情。举个例子，假如你有100万，那么你就可以随便花，不用担心自己的生活质量。但但是100万也不是无限的，如果你不小心把这100万花光了，那么你就只能吃土了。所以，这个世界上有很多人穷极一生，都在努力*，希望能够够让自己过上好日子。不过，也有一些人，他们虽然没有那么富有，但是他们却有一颗善良的心，这样的人往往更容易成功。## 一：举债能力是什么意思通俗说下 举债就是国家、团体、个人凭借信誉筹集社会资金所担负的一种债务。举债按偿还期不同可分为短期借款和长期借款。##二：举债经营能力是什么意思对于采用适度举债经营策略的方法有利有弊：1、可以在激烈的市场竞争中迅速筹集资金，有效获得财务杠杆效应，降低企业资金成本，完善治理机制的外在监督因素；2、负债经营不会影响企业所有者对企业的控制权、有利于企业控制权的保持，有利于保持现有股东对于企业的控制；3、大额债务利于克服在生产经营过程中所造成的资金闲置浪费现象，增强其在资金使用上的责任心和紧迫感，自觉加强管理，提高资金利用率和经济效益。4、但负债经营也是一把“双刃剑”，在提高企业获利能力的同时，增加了企业的财务风险适度举债经营策略是指企业以已有的自有资金作为基础，为了维系企业的正常营运、扩大经营规模、开创新事业等，产生财务需求，发生现金流量不足，通过银行借款、商业信用和发行债券等形式吸收资金，并运用这笔资金从事生产经营活动，使企业资产不断得到补偿、增值和更新的一种现代企业筹资的经营方式。你说的公司价值就是资产意思吧,假如你自己有1000万,再借来1000万,那么你可以支配的资金就有2000万,这2000万就是你的资产.如果你负债3000万,那么你的资产就是5000万,你可以支配的资金就就是5000万.",
        "速动比率===速动资产总额/流动负债总额速动资产==流动资产-- 速动比率是流动资产中最具流动性的部分,变现能力极强\n一般速动比率认为这个比值至少应维持在1:1以上,才算财务状况良好 3.营运资本==流动资产--流动负债 营运资本也是衡量企业短期偿债能力的重要指标,表明企业有没有能力偿还短期负债.\n衡量长期负债能力用资产负债率和利息保障倍数反映企业长期负债的偿还能力.资产负债率==负债总额/全部资产总额\n这个比值过高表示企业举债过大,财务风险也就越大.反之则是企业没有充分利用举债能力来增加收益,对股东也是不利的.利息保障倍数==税前利润+利息费用/利息费用\n它是反映企业收益水平支付债务利息的能力,这个比值不能太低.##五：临时举债能力是什么意思1.举债:可以理解为贷款、透支、或者财政赤字，用在不同的环境表达的确切含义不同，不过性质本身都差不多。--\n2.【释义】借债；借钱。--举债成本:可以理解为把借债、借钱、透支、贷款、看做成本。]* 0 个人已赞 __ 赞一个 _ _收藏 本文名称：《举债能力是什么意思？举债能力不足是什么意思》本文链接免责声明：*\n投资有风险！入市需谨慎！本站内容均由用户自发贡献，或整编自互联网，或AI编辑完成，因此对于内容真实性不能作任何类型的保证！请自行判断内容真假！但是如您发现有涉嫌：抄袭侵权、违法违规、疑似诈骗、虚假不良等内容，请通过底部“联系＆建议”通道，及时与本站联系，本站始终秉持积极配合态度处理各类问题，因此在收到邮件后，必会删除相应内容！另外，如需做其他配合工作，如：设置相关词汇屏蔽等，均可配合完成，以防止后续出现此类内容。",
        "股利信号理论的影响股利信号理论的基本前提为资本市场中存在着信息不对称的现象，由于股利政策是由管理者制定的，而管理者掌握着更多的公司信息，如果公司的股利支付率提高，则表明管理者对公司的未来发展持有乐观预期，预示着公司未来业绩将大幅度增长，公司股票价格也会随之增长；而当公司的股利支付率下降时，则表明管理者对公司的发展前景存有疑虑，甚至预期可能出现衰退，公司股票价格也会随之下降。短期持股的投机性股东主要希望通过购进卖出股票赚取差价，而中长期持股的投资性股东也希望公司股价保持稳定上涨的趋势以使其在出售股票时获取更多的收益。因此在股利信号理论的观点之下，投机性股东和投资性股东都会更加希望公司通过提高股利支付率发放高额股利以向公司外部传递出公司发展势头良好的信号，从而拉动公司股价上涨，使自己能够在出售股票的行为中获取更多的投资收益。3.中小股东就股票估值下降及代理成本升高而要求的补偿 相比于单一股权结构公司，在双层股权结构公司的特殊股权安排下，未持有特别表决权股份的中小股东出让了较多的投票表决权，其通过出资获取的股权并不是通常意义上的完整股权，而是在权能上打了折扣的股权，同理可知，外部市场中处于观望状态的投资者同样也会因普通表决权股权权能有所减损而降低对公司股票价格的估值。因股权权能的不完整性导致的股票价格下降的这一段差额实际上是需要实行双层股权结构的公司予以补偿的，这种补偿通常体现在公司于首发上市时在股票发行价格上向股东作出的让步。如前所述，在双层股权结构公司中，少数的个人股东牢牢把控住了公司的经营决策权，现金流权与控制权的背离使两类股权代理成本显著升高，对于为实施双层股权结构而出让表决权导致的股权代理成本的提高，中小股东亦会对公司提出补偿的要求。因此，基于双层股权结构本身的特性带来的公司股票估值下降以及股权代理成本的升高，中小股东会要求公司提高股利支付率以补偿其潜在损失。4.国内“半强制分红政策”的影响 ![举债能力是什么意思？举债能力不足是什么意思我国证监会发布的《上市公司证券发行管理办法》（以下简称发行管理办法）将近三年发放现金股利不低于一定水平作为上市公司增发股票的条件之一，该规定使得有股权再融资需求的上市公司不得不在增发股票前保持较高的现金股利分配水平，被称为我国的“半强制分红政策”。",
        "刘杰说，2012年，优刻得年收入100万元，2013年实现了月收入100万元。到2015年，优刻得日收入100万元。\n取得如此迅猛发展的原因是什么？刘杰说，优刻得这些年的发展得益于张江政策的推动。一方面，虽然优刻得注册在上海杨浦，但仍然享受到了大张江的政策，包括上市补贴、高成长补贴等资金支持。另一方面，张江的人才引进政策帮助公司引才留才，这对公司的稳定发展提供了支持。\n此外，优刻得是to B企业，其服务对象是企业客户。“其实张江十年来孵化了很多非常好的企业，这些企业当中有很多是我们的客户，我们是伴随着客户的成长而成长。”",
        "重庆\n奇安信科技集团股份有限公司、优刻得科技股份有限公司、寒武纪行歌科技有限公司、优三缔科技有限公司、星环信息科技股份有限公司、拓维信息系统股份有限公司、深圳市有方科技股份有限公司等企业代表发言，介绍了在渝发展规划，感谢重庆对企业项目的大力支持。大家说，重庆产业基础坚实，数字经济发展蓬勃向上，对未来发展充满信心。将依托重庆产业优势，推动项目落地落实，助力建设数字经济发展新高地。\n据了解，此次签约共涉及20家企业，签约项目涉及大数据、云计算、人工智能、车联网、物联网、智能制造、智慧城市等领域，签约项目金额共计约36亿元，引进各类中高端人才5000余人。\n签约企业、有关区和市有关部门负责人参加。\n来源：重庆日报\n声明：除原创内容及特别说明外，素材来源于网络，版权归原作者所有，如涉及侵权，请及时联系我们删除。",
        "同时，公司将利用本次募集资金进一步加强在金融科技、国际化等战略领域的投入，并适时把握战略性并购机会。公司将以整体战略为导向，结合各业务发展规划，统一管理和分配资本金。”中金公司表示。\n（作者：周莹 ）",
        "泽璟制药董秘高青平说。眼下，公司正利用募集资金推动11个创新药物的研究计划，“二期新药研发和生产中心”建设也在积极准备中。\n作为央企华润集团旗下半导体投资运营平台，2月27日登陆科创板的华润微电子有限公司以“A股红筹第一股”的身份受到关注。在华润微常务副董事长陈南翔看来，科创板着眼市场化、国际化、专业化，具备包容性、开创性、突破性，为公司发展带来了新的驱动力。“科创板助力公司建立起现代企业治理架构，令我们以更大的格局审视发展规划。”\n“我们欢迎更多的企业到科创板上市。”上海市地方金融监管局、金融工作局局长解冬表示，虽然科创板是以硬科技为主的企业，但同时也包容符合科创属性的金融科技行业龙头企业、以信息技术为核心的模式创新企业、具有较高科技含量的科技应用创新型企业在科创板上市，希望科创板成为创新创业企业上市的“首选之地”。\n“试验田”示范效应显现：期待科创板改革“再出发”\n27日，中央全面深化改革委员会会议审议通过了《创业板改革并试点注册制总体实施方案》，为创业板注册制改革揭开序幕。\n各方也期待，完成从零到百家的平稳起步之后，科创板能从新的起点“再出发”，真正成为科技创新的资本“助力器”。\n",
        "同时，在测算本次发行对即期回报的摊薄影响过程中，公司对2020年归属于上市公司所有者的净利润的假设分析并非公司的盈利预测，为应对即期回报被摊薄风险而制定的填补回报具体措施不等于对公司未来利润做出保证，投资者不应据此进行投资决策，投资者据此进行投资决策造成损失的，公司不承担赔偿责任。提请广大投资者注意。\n三、本次向特定对象发行股票的必要性和合理性\n（一）本次向特定对象发行股票的必要性\n1、满足本次募集资金投资项目的资金需求\n为进一步拓展公司主营业务，为公司云计算业务发展提供可靠、有力的资源保障，同时有效满足大客户规模化需求及定制化要求，公司拟通过本次发行募集资金用于“优刻得青浦数据中心项目（一期）”建设并补充流动资金。\n随着公司业务规模的扩大、客户需求的增长，公司对数据中心机柜资源的需求进一步增加。公司通过“优刻得青浦数据中心项目（一期）”的实施，实现数据中心自建，在满足客户规模化需求及定制化要求的同时，可以充分发挥资本优势，进一步降低综合成本，提升公司的盈利能力；同时使用部分募集资金用于补充流动资金，有助于降低公司财务风险，提高公司的偿债能力和抗风险能力，缓解公司的资金压力，保障公司研发创新及业务扩张等活动的持续正常开展。由于上述募集资金投资项目所需资金规模较大，公司使用自有资金或进行债务融资可能为公司带来较大的资金压力，因此公司选择本次向特定对象发行股票募集资金以解决上述募集资金投资项目的资金需求。\n2、符合公司经营发展规划\n本次向特定对象发行股票募集资金的运用符合公司自建数据中心的业务规划。募集资金投资项目建设完成后，公司可以有效减少对第三方IDC服务商的资源依赖，为自身云计算业务发展提供可靠、有力的资源保障，满足更多客户的规模化及定制化需求。本次向特定对象发行股票符合公司未来经营发展规划，有利于公司业务的持续发展，也符合公司及全体股东的利益。\n3、向特定对象发行股票募集资金是公司当前融资的最佳方式\n与股权融资相比，通过贷款融资和通过发行债券的方式进行资金筹集会为公司带来较高的财务成本。如公司通过上述两种方式进行融资，一方面会导致公司整体资产负债率上升，提高公司的财务风险，降低公司偿债能力和抗风险能力，另一方面会产生较高的利息费用，挤压降低公司整体的利润空间，不利于公司的稳健发展。",
        "同时，在测算本次发行对即期回报的摊薄影响过程中，公司对2020年归属于上市公司所有者的净利润的假设分析并非公司的盈利预测，为应对即期回报被摊薄风险而制定的填补回报具体措施不等于对公司未来利润做出保证，投资者不应据此进行投资决策，投资者据此进行投资决策造成损失的，公司不承担赔偿责任。提请广大投资者注意。\n三、本次向特定对象发行股票的必要性和合理性\n（一）本次向特定对象发行股票的必要性\n1、满足本次募集资金投资项目的资金需求\n为进一步拓展公司主营业务，为公司云计算业务发展提供可靠、有力的资源保障，同时有效满足大客户规模化需求及定制化要求，公司拟通过本次发行募集资金用于“优刻得青浦数据中心项目（一期）”建设并补充流动资金。\n随着公司业务规模的扩大、客户需求的增长，公司对数据中心机柜资源的需求进一步增加。公司通过“优刻得青浦数据中心项目（一期）”的实施，实现数据中心自建，在满足客户规模化需求及定制化要求的同时，可以充分发挥资本优势，进一步降低综合成本，提升公司的盈利能力；同时使用部分募集资金用于补\n充流动资金，有助于降低公司财务风险，提高公司的偿债能力和抗风险能力，缓解公司的资金压力，保障公司研发创新及业务扩张等活动的持续正常开展。由于上述募集资金投资项目所需资金规模较大，公司使用自有资金或进行债务融资可能为公司带来较大的资金压力，因此公司选择本次向特定对象发行股票募集资金以解决上述募集资金投资项目的资金需求。\n2、符合公司经营发展规划\n本次向特定对象发行股票募集资金的运用符合公司自建数据中心的业务规划。募集资金投资项目建设完成后，公司可以有效减少对第三方IDC服务商的资源依赖，为自身云计算业务发展提供可靠、有力的资源保障，满足更多客户的规模化及定制化需求。本次向特定对象发行股票符合公司未来经营发展规划，有利于公司业务的持续发展，也符合公司及全体股东的利益。\n3、向特定对象发行股票募集资金是公司当前融资的最佳方式\n与股权融资相比，通过贷款融资和通过发行债券的方式进行资金筹集会为公司带来较高的财务成本。如公司通过上述两种方式进行融资，一方面会导致公司整体资产负债率上升，提高公司的财务风险，降低公司偿债能力和抗风险能力，另一方面会产生较高的利息费用，挤压降低公司整体的利润空间，不利于公司的稳健发展。",
        "2、公司发展目标和未来发展战略（1）发展目标 公司将致力于为广大企业客户提供更简单易用、安全可靠的云计算服务产品，特别 是为新兴科技企业、转型传统企业等国家重点发展领域，提供更加灵活、定制化的云计 算服务，同时兼顾股东、员工、合作伙伴、社会等各方利益，制定务实、可行的中长期 发展规划，持续、健康地发展，不断巩固和提升行业地位，成为行业领先、受人尊敬的 云计算公司。（2）发展战略 近年来互联网产业的发展由消费互联网驱动逐步转向产业互联网驱动，而产业互联 网的构建和智能化升级更依赖于云计算技术、大数据技术以及人工智能技术的结合。为 适应行业及技术未来发展趋势，更好服务企业客户，公司提出由云计算（ Cloud Computing）战略、大数据（Big Data）战略、人工智能（ AI）战略共同组成的 “CBA” 发展战略。未来公司将贯彻“CBA”发展战略。在云计算领域，公司将坚持行业突破战略，重点 开拓传统行业，通过渠道合作、资本合作等多种形式，与各行业领军企业联合打造行业 解决方案，实现互利共赢。在大数据领域，公司将以促进数据安全便捷流通，挖掘数据 价值为目标，以实验室为载体加大技术投入，研发数据安全技术和数据分析技术，让更 多机构实现数据的统一融合和交叉分析。在人工智能领域，公司将恪守中立定位，持续 投入研发资源，构建涵盖数据采集、数据处理、人工智能算法探索、人工智能算法训练、 人工智能在线服务的一站式全流程人工智能基础服务平台为客户提供服务，在保障数据 1-1-35 优刻得科技股份有限公司募集说明书 安全的前提下引入专业的算法提供商，建设人工智能算法市场，与合作伙伴共同将人工 智能基础服务推广到各大传统行业中，推动新零售、新金融、新制造、新医疗、新能源 的行业转型，为企业降本提效提供智能化管理工具。3、公司当前的业务战略布局未发生改变 公司当前在主要产品和客户拓展上的总体战略没有发生改变，公司始终致力于为客 户打造一个安全、可信赖的云计算服务平台，并通过公有云、混合云、私有云三种模式 为用户提供服务。公司作为一家总部在上海的企业，需要大力拓展华东地区的业务，近 年来公司不断在华东地区进行大客户开发，已经同携程、拼多多、哔哩哔哩等大客户建 立了业务合作。",
        "重庆 奇安信科技集团股份有限公司、优刻得科技股份有限公司、寒武纪行歌科技有限公司、优三缔科技有限公司、星环信息科技股份有限公司、拓维信息系统股份有限公司、深圳市有方科技股份有限公司、北京地平线信息技术有限公司等企业代表发言，介绍了在渝发展规划，感谢重庆对企业项目的大力支持。大家说，重庆产业基础坚实，数字经济发展蓬勃向上，对未来发展充满信心。将依托重庆产业优势，推动项目落地落实，助力建设数字经济发展新高地。据了解，此次签约共涉及20家企业，签约项目涉及大数据、云计算、人工智能、车联网、物联网、智能制造、智慧城市等领域，签约项目金额共计约36亿元，引进各类中高端人才5000余人。签约企业、有关区和市有关部门负责人参加。*大家都在看*1079.29亿元！34个项目！川渝国企高竹新区签约合作 一批工业重大项目，开工！*诗盛三峡！夔门一推开，诗从天上来……*来源：重庆日报客户端 记者：杨帆",
        "##三：举债能力强是什么意思",
        "钱世政\n复旦大学管理学院教授\n科技性公司（科创版）一看赛道，二看同行，三看毛利率及成长性，再看研发投入及成果。纵向看历史，横向看同行，纵横捭阖才能找到公允值。\n科技公司的战略转型是个高风险的过程，用公募加私募的融资方式一可降风险，二可创造新价值。\nPART2.\n科技与人文的交融\n本模块的“晚课堂”内容丰富，不仅有领军科创企业家讲堂邀请生物制药领域的行业专家对生物制药企业的发展和创新进行解读，还创新设立了人文课堂，今后将有更多哲学、历史类讲座来拓展、丰富科创学员的视野。\n|领军科创企业家讲堂\n俞德超\n信达生物制药集团创始人、董事长兼首席执行官\n什么样的生态体系是能支撑创新药的发展，它的创新要素是什么，四个方面最重要：第一，基础研究，这是源头。第二，监管科学。监管是一门科学，不是政策。第三，资本市场，资本要有闭环，要源源不断有人投，有人出局。第四，支付体系。\n同很多行业不一样，中国的生物制药企业要走到国际上去，最后在国际上有一席之地，最根本的不是商业也不是渠道，而是硬科技。它真的能做出一个产品，真正解决临床的问题，并且别的企业没有。\n|",
        "卫哲则表示，对于数据保护，各国标准并不一致，欧洲最严、美国其次。“我想提醒的是没有灵丹妙药，不要认为我不是做互联网的就没有问题。今天哪怕你是消费电子产品，都要树立这个意识。”另外，卫哲表示，中国很多创意产品、软件类产品是有能力出海的，但很多企业创始人在包括著作权法等方面的国际化法律知识非常薄弱，一旦被侵犯了知识产权，根本不知道找谁来解决问题。也因此，卫哲表示，在通过服务贸易走出去的过程中，企业要加强数据安全和知识产权的自我保护。*沪苏同城打造服务贸易新高地*长三角区域一体化发展上升为国家战略已经三周年，沪苏同城化已列入《长三角一体化发展规划“十四五”实施方案》，多家企业都表示，打造长三角服务贸易集聚区既是需求亦是机遇。在推动服务贸易创新发展中，适应服务贸易自由化新趋势的海南自由贸易港和自由贸易试验区，身兼重任。",
        "具体内容详见公司于 2020 年9 月12日在上海证券交易所网站（www.sse.com.cn）披露的《优刻得科技股份有限公司关于向特定对象发行A股股票摊薄即期回报与填补措施及相关主体承诺的公告》（公告编号：2020-037）。\n以上议案已经公司第一届董事会第十六次会议及第一届监事会第八次会议审议通过。\n现将此议案提交股东大会，请予审议。\n优刻得科技股份有限公司2020年9月28日\n议案八关于公司未来三年（2020年-2022年）股东分红回报规划的议案\n各位股东及股东代表：\n为进一步规范和完善公司利润分配政策，建立科学、持续、稳定、透明的分红决策和监督机制，积极回报投资者，根据中国证监会《关于进一步落实上市公司现金分红有关事项的通知》（证监发[2012]37号）、《上市公司监管指引第3号——上市公司现金分红》（证监会公告[2013]43号）以及《公司章程》等相关文件的规定和要求，并结合公司盈利能力、公司经营发展规划、股东回报以及外部融资环境等因素，公司制定了未来三年（2020年-2022年）股东分红回报规划。\n具体内容详见公司于 2020 年9 月12日在上海证券交易所网站（www.sse.com.cn）披露的《优刻得科技股份有限公司未来三年（2020-2022年）股东分红回报规划》。\n以上议案已经公司第一届董事会第十六次会议及第一届监事会第八次会议审议通过。\n现将此议案提交股东大会，请予审议。\n优刻得科技股份有限公司2020年9月28日\n议案九关于提请股东大会授权董事会及其授权人士全权办理本次向特定对\n象发行股票具体事宜的议案\n各位股东及股东代表：\n根据公司本次向特定对象发行股票的安排，为合法、高效地完成公司本次发行工作，依照《中华人民共和国公司法》、《中华人民共和国证券法》等法律、法规及《公司章程》的有关规定，提请公司股东大会授权董事会及董事会授权人士全权办理与本次发行有关的全部事宜，包括但不限于：\n1、根据相关法律、法规、规范性文件或证券监管部门的规定或要求，结合公司的实际情况，对本次发行方案进行适当调整、补充，确定本次发行的最终具体方案并办理发行方案的具体实施，包括但不限于本次发行的实施时间、发行数量、发行价格、发行对象、具体认购办法、认购比例、募集资金规模及其他与发行方案相关的事宜；\n",
        "尤洛卡招聘（尤洛卡）\n本篇文章是有关尤洛卡的讲解，相信很多朋友对这方面不是特别的了解，所以借着本篇文章的机会，说说尤洛卡招聘的内容，希望对各位有所帮助！\n泰安尤洛卡股份有限公司怎么样\n1、尤洛卡在泰安是中上水平。尤洛卡公司是国家级高新技术企业，国家火炬计划重点企业，总部设立在雄壮美丽的泰山脚下——山东省泰安市，公司位于泰安市高新技术产业区，高新技术产业区兴起，对专业技术人员需求大。\n2、不多。根据查询泰安尤洛卡公司官网显示，泰安尤洛卡公司辞职的人不多，该公司待遇好，综合工资是3000到4000，上六休一，有五险一金，工作轻松，无体力活，话费补贴，提供员工餐，员工满意度高，福利待遇好。\n3、千万不要去尤洛卡。太坑人了。把你招聘进去，耽误你几个月的时间，然后再要求你辞职，一个月就1200.在里面带几个月后公司要求你自己辞职。不是一般的坑，如果时间多的用不了，必须浪费，就去尤洛卡吧。\n4、根据泰安尤洛卡公司的人力资源数据，截止到2023年9月之前，辞职人数相对较少。公司实行了一系列的员工福利政策和职业发展计划，提供了良好的工作环境和发展机会，使得员工对公司的满意度较高。\n5、简介： 尤洛卡矿业安全工程股份有限公司前身为泰安市尤洛卡自动化仪表有限公司，于1998年10月29日经泰安市工商行政管理局核准成立。2008年1月29日公司整体变更设立为股份有限公司。\n尤洛卡单轨吊机车驱动轮是什么夹紧方式?\n1、尤洛卡单轨吊机车只能起吊不能行走的原因是：结构设计、起重能力。尤洛卡单轨吊机车的结构设计决定了它只能进行起吊操作。这种吊车的车身上只有一条轨道，它通过在轨道上滑动来进行移动。\n尤洛卡在泰安是什么水平\n好。福利好。泰安尤洛卡股份有限公司为员工购买了五险一金，非常，保证了员工的日常生活。待遇好。泰安尤洛卡股份有限公司员工工资在8000元，每个节假日都有单独的礼品，每月的饭补为300元，还有旅游卡，待遇丰厚。\n千万不要去尤洛卡。太坑人了。把你招聘进去，耽误你几个月的时间，然后再要求你辞职，一个月就1200.在里面带几个月后公司要求你自己辞职。不是一般的坑，如果时间多的用不了，必须浪费，就去尤洛卡吧。\n不多。",
        "用友网络科技股份有限公司\n|云服务（SAAS云）\n|二级\n|北京飞书科技有限公司\n|云服务（SAAS云）\n|二级\n更多推荐阅读\n【年度数据】ITSS认证-2023年度总结\nITSS认证常见问题？\n【认证新方向】ITSS数据中心服务能力成熟度评估\nITSS认证是什么？2023年最新汇总ITSS认证补贴政策",
        "公司本次募投项目选址上海建设数据中心，秉承公司在一线城市进行数据中心建设的整体战略规划。公司在前次募集资金到账前就在积极寻求上海进行数据中建设的土地及机柜指标等条件，并于2019年、2020年先后获得了上海青浦的用地和机柜建设的相应指标，陆续投入资金进行本次募投项目的建设。公司本次募投项目可以有效解决阻碍公司在上海业务拓展的机柜资源紧缺的情况，建设具备紧迫性与必要性。\n综上，公司前次募投项目投入调减仅为出于稳健经营的考量，减少了募集资金的投入，不改变公司前次募投项目建设的整体规划，也不会改变公司在一线及一线周边城市自建数据中心的发展战略，不会影响公司本次募投项目的实施。公司通过前次募投项目和本次募投项目，可以逐步实现在一线城市和一线周边城市的数据中心布局，未来公司会按照上述规划持续推进在一线和一线周边城市的数据中心建设，形成完整的自建数据中心体系。\n8-1-2-18\n（五）结合前述问题进一步说明本次募投项目的收益测算是否谨慎、合理，请发行人根据实际情况补充风险提示内容。公司目前在上海地区的业务体量较小，主要受公司在上海地区起步较晚、且服务器资源紧缺导致。公司优先进行上海数据中心的建设，符合公司在一线及一线周边城市建设数据中心的长期发展规划。上海地区对于公有云、混合云的业务需求较大，公司可以凭借自身中立属性及差异化竞争优势，满足客户需求，充分消化本次募投项目新增产能，同时避免进入降价竞争。公司本次募投项目的收入测算已经考虑到未来公有云产品价格下降的趋势及价格下降对公司产品毛利率的影响，测算过程具有谨慎性及合理性。\n但与此同时，由于市场环境及公司主要竞争对手的策略选择具有不可预见性，可能导致公司本次募投项目的实际收益与测算情况存在差异，公司已经在募集说明书中补充了风险提示如下：\n6、市场环境重大变化及竞争对手持续竞争性降价导致募投项目收益不达预期的风险\n公司本次募投项目收益测算基于当前市场环境及竞争对手的当前市场策略做出，云计算业务的特殊属性决定了云计算厂商长期竞争性降价难以形成垄断，不是行业最佳的竞争策略，但由于市场环境的重大变化存在不可预见性，公司主要竞争对手也存在采取持续竞争性降价、扩大亏损以实现市场份额短期提升的可能性，公司本次募投项目存在实际收益不达预期的风险。\n二、保荐机构核查意见\n1、核查过程及核查方式\n",
        "司长期发展规划，不存在损害公司及公司股东，特别是中小股东利益的情形。因\n此监事会同意本次利润分配方案，并同意将该议案提交股东大会审议。\n三、相关风险提示\n（一）本次利润分配方案案符合公司的实际经营情况，有利于公司的可持续\n发展，不会对公司的正常经营活动产生重大不利影响。\n（二）本次利润分配方案尚需提交公司 2022 年年度股东大会审议批准，敬\n请广大投资者注意投资风险。\n特此公告。\n",
        "值得一提的是，2012 年是中国云计算的鸿蒙时期，以阿里、腾讯为代表的的云计算巨头厂商，他们背靠强大的母公司，无论是在资金、品牌、技术、产品或者生态等方面占据得天独厚的优势。\n在巨头业务生态中成长不同， UCloud 由创业公司发展而来。那么UCloud 是如何打出差异化战略，能在红海一片的云计算战争中获得一席之位呢？差异化战略又是什么呢？\n差异化定位“中立”\n围绕客户需求拓展自身边界\n季昕华指出，任何一家从创业环境走出来的挑战者，都无法平视市场。它们一定是以倾斜的角度，看到一个极难攀登的斜坡。所以没有办法完全走别人走过的路，差异化是 UCloud 的一个必然的选择。\n成功的差异化，一定是瞄准那最难 1%的取胜机会，而不是选择 99%的人选择的随波逐流。\nUCloud 之所以能够在巨头环伺的云计算世界赢得了一席之地，它的生存之道，本身就是一种差异化的路线使然。\n具体来说，可以从这几方面来看UCloud 差异化战略。\n第一，在定位方面，“中立” 一直是 UCloud 云计算的差异化标签。公司坚持中立不涉足客户的业务，不与客户和合作伙伴竞争。其次，不碰用户数据，无论客户是什么行业，大家都可以放心的使用UCloud 的优质云服务，无需担心数据被“窥探”、被“研究”、被“利用”。\n第二，在研发方面，产品体系专注于公有云 IaaS 和基础 PaaS 业务。UCloud以价值为导向，倾向提供高附加值的以及为客户定制化的、创新的产品和服务，如云主机、数据库、数据分析等产品，是公司着重发展的业务重点。\n第三，在行业方面，UCloud 重点选择成长性高、能带来高附加值业务的客户。\n据悉，UCloud深耕传统企业细分领域，选取转型速度快、云化需求比较大，行业市场空间较大、格局分散的领域，同时，UCloud的中立定位、全内资属性在向一些行业重点突破时，能发挥较大的优势，如政府、运营商、零售及智能制造等。\n上述客户经过一定时间的发展，业务规模逐渐成长，不断将业务部署至云端，也带动着UCloud营业收入的增长。\n第四、在生态方面，UCloud 坚持“开放、合作、共赢”的理念。开放 UCloud云计算差异化的核心能力，与合作伙伴联手，优势互补，共同助推产业变革和升级。\n",
        "公司于 2022年 4月 26日召开的第二届监事会第四次会议审议通过了《关于公司<2021年度利润分配方案>的议案》，监事会认为，公司 2021年度利润分配方案是公司基于行业发展情况、公司发展阶段、自身经营模式及资金需求的综合考虑。符合法律法规及《公司章程》的相关规定，符合公司经营现状，有利于公司长期发展规划，不存在损害公司及公司股东，特别是中小股东利益的情形。因此监事会同意本次利润分配方案，并同意将该议案提交股东大会审议。\n三、相关风险提示\n（一）本次利润分配方案案符合公司的实际经营情况，有利于公司的可持续发展，不会对公司的正常经营活动产生重大不利影响。\n（二）本次利润分配方案尚需提交公司 2021年年度股东大会审议批准，敬请广大投资者注意投资风险。\n特此公告。\n优刻得科技股份有限公司\n董事会\n2022年 4月 27日\n中财网",
        "]* PIXELBUNNY 亲亲家的衣服超级性感好看，非常棒。]* Cherry Quahst人生苦短，生活总是太忙碌，为梦为念一路执着。]* 镜酱：你爱我，像阵风，留不住，带不走。]* 爱情是什么，爱情不是色戒就是钻戒。][\n!\nUcloud ] ! 关注网络尖刀微信公众号 随时掌握互联网精彩 赞助链接 [\n!\n][\n!\n][\n!\n][\n!\n][\n!\n][\n!\n][\n!\n]",
        "公司于 2022年 4月 26日召开的第二届监事会第四次会议审议通过了《关于公司<2021年度利润分配方案>的议案》，监事会认为，公司 2021年度利润分配方案是公司基于行业发展情况、公司发展阶段、自身经营模式及资金需求的综合考虑。符合法律法规及《公司章程》的相关规定，符合公司经营现状，有利于公司长期发展规划，不存在损害公司及公司股东，特别是中小股东利益的情形。因此监事会同意本次利润分配方案，并同意将该议案提交股东大会审议。\n三、相关风险提示\n（一）本次利润分配方案案符合公司的实际经营情况，有利于公司的可持续发展，不会对公司的正常经营活动产生重大不利影响。\n（二）本次利润分配方案尚需提交公司 2021年年度股东大会审议批准，敬请广大投资者注意投资风险。\n特此公告。\n优刻得科技股份有限公司\n董事会\n2022年 4月 27日\n中财网",
        "国家工业信息安全发展研究中心发布的《人工智能中国专利技术分析报告》显示，百度、腾讯、中国科学院等国内主要专利权企业正不断形成人工智能技术积累，提升在全球人工智能专利布局中的竞争实力。报告显示，自2014年至2018年间我国人工智能领域专利申请数量呈快速增长状态，2018年我国专利申请量达到94539件，为2010年申请量的10倍。报告中人工智能申请人专利申请数量显示前10位企业中，百度以5712件专利位居榜首，紧跟其后的为腾讯4115件，浪潮集团3755件，华为3656件。近年来，中国人工智能产业发展迅速，语音识别和计算机视觉成为国内人工智能市场最成熟的两个领域。据前瞻产业研究院报告统计数据显示，自2015年开始，中国人工智能产业规模逐年上升，据中国信通院数据，2015年到2018年复合平均增长率为54.6%，高于全球平均水平。2018年，中国人工智能产业市场规模已达到415.5亿元。2015-2018年中国人工智能产业市场规模统计情况 ![](https://iknow-\npic.cdn.bcebos.com/91529822720e0cf3f2ab77960546f21fbe09aa7a?x-bce-\nprocess=image/resize,m_lfit,w_600,h_800,limit_1/quality,q_85) 数据来源：前瞻产业研究院整理 在2017年国务院发布的《新一代人工智能发展规划》中表明，到2020年人工智能产业规模会超过1500亿元，带动相关产业规模超过1万亿。",
        "工商局，现在是市场监管局，他收了我们的文件，这个是同股不同权的没法处理，上海还是非常支持的，我们接下来先做研究，中间做了很多很多的沟通。\n三是最高法在去年6月底出了一个司法解释。中国为了科创板允许同股不同权的尝试，就把所有相关法律障碍全部走通，所以最后我们有机会做这个事情。这说明中国科创板整个制度确实是和国际领先的规则相匹配的、相适应的，也体现了整个科创板的一个包容性的情况。\n问：在沟通过程中，最困难的地方在哪里？\n季昕华：最困难是因为之前没有做过，所以大家不敢尝试，这是最大的问题。股东们不敢尝试，相关的部门怕做了这个事情有风险。\n作为一家科技创新公司，如果我们不尝试，谁尝试这个事情？如果我们不做云计算，中国就没有中立的云计算公司，我们不做AB股，中国就没有AB股公司了。所以优刻得虽然没有背景，但是我们有梦想，所以我们会愿意为梦想做尝试和突破，幸好结果是好的。\n问：你认为公有云同股不同权第一股在中国资本市场首开先河，会不会有一个示范效应，会带来哪些效应呢？\n季昕华：这里有一个细节，我们上市推进时间长一些，很多的公司的老板他们微信或者打电话给我，问“你们现在怎么样了”。\n大家可能注意到了一个现象：在我们报完之后，没有一家（科创板）公司提出AB股的，因为大家担心AB搞不定。他们看着我们往前冲，我们冲成功了，他们就跟着上了。\n所以有很多人跟我打电话说，恭喜你们成功了。说明科创板制度确实是写到了也做到了，给大家一个非常大的信心。这是非常关键的，这能够让更多的企业相信政府说到做到，这是一个非常重要的信心。\n第二，像我们这家做创业公司和国内的巨头都是竞争的，这样的公司在国内也能够有机会成长起来了。\n第三，我是农村出来的孩子，什么背景都没有，只有梦想和部分的技术，像我这样一个没有任何背景的人都能够在中国当前的环境下能成长起来，发展起来，能创业走到今天，说明中国的整个流通机制是很好的。在中国只要你有技术，你有梦想，没有任何背景，都有机会成长起来。未来会有N多比我更优秀的，比我更年轻的，比我更有能力的人在中国能有机会发展。\n下一步规划\n问：公有云目前仍是优刻得营收的大头，华为等企业都在猛追这一块市场，你们如何应对？\n季昕华：未来我们还是看公有云，因为公有云是未来的发展趋势。我们如何跟他们竞争呢？围绕几个方向：\n一是我们的中立性。我们跟用户客观竞争，用户跟我们的关系非常好。",
        "温州银行上海分行日前联合上海市浙江青年企业家协会共同举办的“2024温暖迎新科创沙龙”活动，活动邀请了上海市浙江青年企业家协会的科创企业代表20余人参加分享交流。此次活动旨在促进金融机构与科技企业之间的交流，搭建合作平台，了解科技企业对金融服务的需求和期待。\n温州银行上海分行党委委员、副行长厉陈斌在活动致辞中表示，温州银行上海分行始终秉承金融服务实体经济的使命，支持重大技术攻关和战略性新兴产业成长，从科技企业不同阶段的金融需求特点出发，致力提供多元化、接力式金融服务，帮助科技型企业的“技术流”转化为“资金流”，全力支持科技企业创新发展。\n活动中，上海市浙江青年企业家协会会长、优刻得科技股份有限公司董事长季昕华作主题演讲，他提出，科技创新是推动社会进步和经济发展的重要力量，科技企业需要与金融机构建立良好的合作关系，共同应对市场的挑战和机遇。\n温州银行上海浦东支行负责人围绕温州银行上海分行科创业务进行介绍。作为上海分行科创金融发展最活跃的支行，支行将银商合作作为支持科创企业的主要渠道，运用温州银行“科易贷”“温信贷”“共富创业贷”等小额灵活信贷产品做好在沪浙商、温商的服务工作；积极向总行申请提高科创业务信用保证类贷款授信审批权限，简化贷款审批流程，积极为科创企业开通信贷绿色通道。\n在企业交流环节，各会员单位以科创企业融资为主题，交流企业发展规划及经营难点，结合具体案例深入解析，并就如何更好地解决科技企业在融资方面遇到的困难和挑战，提出了有建设性的意见和建议。在场的温州银行工作人员逐一给予相应的解答与实用性建议。\n此次沙龙为科创企业的“融资难”问题提供了服务平台，得到了企业家们的一致好评。近年来，温州银行上海分行为科技企业发展注入源源不断新动能，截至2023年末，分行科创贷款业务余额11.43亿元，较年初增长5.66亿元，增幅98.09%。下一步，温州银行上海分行将持续优化营商环境，搭建银企合作桥梁，引金融活水浇灌科创企业，为金融服务实体经济积极贡献力量。",
        "双层股权结构符合股东异质化的发展趋势，换言之，双层股权结构诞生的初衷之一，便是满足多样化投资主体的不同投资需求，因此不同类型投资者的投资需求均应当得到应有尊重。由此可知，破解异质化股东不同投资目的导致的股利分配困境的关键在于根据公司不同发展阶段的实际情况采取灵活的股利分配政策以协调各方利益。\n对于刚上市的处于快速成长阶段的科创公司而言， 其最迫切的需求在于继续维持高速的增长，而维持高速增长的前提之一是公司掌握充足的现金储备。因此，在此阶段，中小股东的短期利益需要让位于公司的整体发展需求，应当允许公司在成长期实施较低的股利分配政策。\n当公司发展至成熟阶段后，公司应当提高股利支付率以回报股东，尤其是对于持股期限较长的投资性股东，可以进行适当的倾斜性分配。原因在于投资性股东的出资是公司最重要的资本来源，也是在实施双层股权结构过程中实际出让权利最多的一方，并且若公司在成长期中实施较低的股利分配政策，投资性股东亦会在陪伴公司成长的过程中损失较多的现金股利收益。\n此外，经营性股东对公司长远发展的关注也应当得到肯定，科创企业提升创新能力，实施长期发展战略，不仅符合公司投资者的期待，亦符合国家战略规划和社会公众的期待，具有天然的正当性。因此，在公司管理层能够提出具体可行的科研开发计划及长期发展规划并得到历史执行经验的支持时，应当允许公司适当降低股利支付率以保证公司能够维持较高的科研开发水平和持续发展潜力。\n以上针对公司不同发展阶段以及不同主体利益诉求而进行的股利分配政策的调整，可以通过事先在公司章程中进行约定而实现。股东可以在公司章程中以公司所处的发展阶段为标准，具体约定较为明确的最低基准股利支付率，同时还应针对特定的情形以及特定类型的投资者，约定在最低基准股利支付率上进行调整的具体方式。\n优刻得公司在公司章程中规定现金分红政策的制定应当综合考虑公司所处的行业特点、发展阶段等各方面因素。该公司章程在对公司的发展阶段按照成长期和成熟期进行划分的基础上，将重大资金支出安排作为重要考虑因素之一，并对其进行了明确的定义，然后根据不同的组合情形分别规定了最低现金股利支付率，如规定在公司发展阶段处于成长期且有重大资金支出安排时，最低的现金分红比例应达到20%。\n",
        "- +1\n长三角企业走进罗湖！未来发展利好值得期待\n筑巢引凤，共谋发展\n长三角企业家走进罗湖活动\n成功举办啦\n7月26日，来自长三角的多位企业家走进罗湖，与相关部门展开座谈交流、共谋合作，并现场考察罗湖深港现代商贸业升级发展区指挥部、清水河总部新城建设指挥部，近距离感受新罗湖转型蝶变和筑巢引凤的诚意。区领导左金平、詹辉参加活动。\n当天出席活动的企业有：上海长三角商业创新研究院、迪安诊断技术集团股份有限公司、银山集团有限公司、阿斯利康中国南部总部、信达生物制药(苏州)有限公司、同程旅行控股有限公司、优刻得科技股份有限公司、云知声(杭州)智能科技有限公司、杭州医策科技有限公司。\n此次活动透露出哪些信号？\n未来罗湖将迎来哪些利好？\n一起来看\n罗湖\n是中国改革开放的策源地\n是深圳速度和深圳高度的代名词\n经过40多年的发展\n罗湖形成了金融业、商贸业、\n商务服务业、战略性新兴产业\n四大主导产业\n成为深圳的金融核心区、\n商贸流通旺地、现代服务业强区\n近年来，罗湖锚定大健康、软件与信息服务、智能终端等“7+1”战新产业与未来产业，通过加快释放优质产业空间、提升营商环境能级、加强精准招商与企业服务力度，吸引了迪安诊断、软通动力、闻泰科技等一批战新产业龙头企业入驻。近五年，罗湖战新企业数量同比增长200%，企业营收同比增长366%。\n今年以来，围绕重点发展的产业方向，罗湖区已引进国家高新技术企业72家，并推动中欧创新医药与健康研究中心这一重大应用基础型科研平台落地。\n此外，作为医改试点先锋，罗湖区开启了“以人民健康为中心”的一系列医疗卫生服务体系改革，罗湖医联体改革模式入选了国家深化医改重大典型经验。为进一步纵深推进罗湖医改，罗湖区以开放的姿态与全国优质的生命健康产业龙头企业合作。\n此次长三角企业家走进罗湖\n是罗湖区开展精准招商的\n又一缩影\n参加活动的企业均来自大健康、新一代信息技术等赛道，且对于拓展业务合作、开辟深圳市场、布局湾区总部有一定规划基础。\n借此次活动东风，罗湖区向长三角企业家展现宏伟的规划蓝图、优质的营商环境、完备的产业政策体系，进一步坚定企业投资罗湖的信心。\n一直以来\n罗湖十分重视产业链招商\n通过链主企业链接资源、渠道、信息\n不断拓展招商“朋友圈”\n旨在通过强链、延链、补链\n助力龙头企业发展、构筑产业生态\n"
    ],
    "ground_truth": "答案: 优刻得科技股份有限公司的未来发展规划主要集中在几个方面：首先，公司计划扩大和优化自建数据中心的建设，如优刻得青浦数据中心项目（一期），以减少对第三方IDC服务商的依赖，这将提升公司的盈利能力和市场竞争力，并增强云计算业务的资源保障。其次，公司致力于金融科技和国际化的进一步投资，积极把握战略性并购机会，并优化资本金的管理和分配。此外，公司还将推动数据流通的三个阶段：政府数据开放、企业间数据流通和跨境数据交流，从而加强数据安全技术的研发和行业解决方案的联合打造，采用“CBA”战略（云计算、大数据、人工智能），以促进传统行业的智能化转型。最后，公司计划继续在重庆及华东地区扩展数据中心，以满足日益增长的业务需求，并通过特定对象股票发行募集所需资金，同时在募集说明书中为投资者提供必要的风险提示，以准备应对市场变动和风险。",
    "answer": "优刻得科技股份有限公司的未来发展规划主要围绕大模型技术和云计算领域的深入开发与应用展开，特别强调算法、算力和数据三大核心要素的重要性。具体发展策略包括：\n\n1. **国产化合作与技术自主研发**：优刻得正在与国产项目合作，推进大模型技术应用。这表明公司致力于支持并借助国产技术力量，提升自身在大数据和人工智能领域的核心竞争力，以期在AI芯片等关键技术上实现突破。\n\n2. **数据要素的高水平应用**：季昕华提出，通过政府引导和加强激励等措施，推动数据要素的协同优化、复用增效、融合创新，提升数据供给水平。这意味着优刻得将注重解决高质量行业数据获取难题，通过提高数据开放程度和供给质量，加速数据与AI技术的结合，进一步促进公司在智能化应用领域的发展。\n\n3. **安全与合作生态建设**：通过与合作伙伴如永信至诚的战略合作，优刻得不仅在大模型安全测试评估领域取得进展，还意在共同研发和训练专用的人工智能模型，以提高网络和数据安全水平，打造安全、稳健的AI应用环境。\n\n4. **云计算市场的深耕与拓展**：优刻得董事长兼CEO季昕华表示，云计算在新一轮人工智能发展浪潮中存在巨大机遇。公司计划深入开发云计算技术，以满足不同行业对于高性能计算和智能化应用的需求，进一步拓宽其在云计算服务市场上的影响力。\n\n总结来说，优刻得的未来发展规划聚焦于利用国产技术合作、加强数据要素应用、打造安全合作生态、以及深化云计算技术应用，旨在强化公司的技术领先地位，并推动其在智能化及云计算服务领域的持续增长和创新。"
}